date,ticker,news,close_price
2018-03-08,BA,Trump to visit Boeing plant in Missouri to tout impact of tax overhaul,333.977783203125
2018-03-08,BA,Boeing says Israel may opt for Chinooks over Sikorsky choppers,333.977783203125
2018-03-08,BA,Exclusive  Japan s new advanced fighter may be based on existing foreign design   sources,333.977783203125
2018-03-08,BA,U S  space companies aim to help Brazil rocket base lift off,333.977783203125
2018-03-08,BA,Indian airlines to add new jets in booming aviation market,333.977783203125
2018-03-09,BA,Exclusive  Boeing has  cash horsepower  for targeted acquisitions   CEO,339.5227355957031
2018-03-09,BA,The Zacks Analyst Blog Highlights  Axon  Boeing  Pioneer Natural And Facebook,339.5227355957031
2018-03-09,BA,Steel Stocks Slide As Trump Softens Tariff Stance Amid Criticism,339.5227355957031
2018-03-09,BA,Bombardier revs up aftermarket business to hit revenue growth target,339.5227355957031
2018-03-09,BA,Huntington Ingalls Wins USS Fitzgerald Repair Deal Worth  77M,339.5227355957031
2018-03-12,BA,New High For NASDAQ As Streak Hits 7 Days,329.6297912597656
2018-03-12,BA,General Dynamics Wins  696M Deal For Nuclear Submarines,329.6297912597656
2018-03-12,BA,Bangladeshi plane crashes in Nepal  killing at least 50,329.6297912597656
2018-03-12,BA,Raytheon  RTN  Wins  40M Deal For B 2 Antenna Modification,329.6297912597656
2018-03-12,BA,Shrug Off Market Gyrations With These Top 5 Value Picks,329.6297912597656
2018-03-13,BA,U S  transfers six surveillance drones to Philippines,324.34332275390625
2018-03-13,BA,Boeing studying options for further boost to 737 production,324.34332275390625
2018-03-13,BA,Trump Dismisses U S  Secretary Tillerson  3 Defense Picks,324.34332275390625
2018-03-13,BA,Hawaiian airlines updates Q1 guidance,324.34332275390625
2018-03-13,BA,New Boeing jet to accelerate services shake up,324.34332275390625
2018-03-14,BA,Financials fare worst today,316.2890930175781
2018-03-14,BA,Day Ahead  Top 3 Things To Watch,316.2890930175781
2018-03-14,BA,Stocks and yields both move lower on session,316.2890930175781
2018-03-14,BA,Dow sheds 250 points as trade war worries weigh on industrials,316.2890930175781
2018-03-14,BA,Boeing seen as prime target in China trade war  slumps for third straight day,316.2890930175781
2018-03-14,BA,GE begins flight trials for GE9X engine after delays,316.2890930175781
2018-03-14,BA,Boeing Lockheed JV Unit Wins  354M AFSPC Satellite Contract,316.2890930175781
2018-03-14,BA,Stock Market Today  March 14  Dow Slumps On Trade War Woes,316.2890930175781
2018-03-14,BA,Stock Market News For March 15  2018,316.2890930175781
2018-03-14,BA,Boeing  Spirit AeroSystems selloff overdone  J P  Morgan says,316.2890930175781
2018-03-15,BA,Powell s Fed Hikes Rates  Global Week Ahead,316.0209045410156
2018-03-15,BA,Tariff Concerns Slam Boeing  And DJIA Falls With It,316.0209045410156
2018-03-15,BA,TransDigm Takes Over Kirkhill  Acquisition Strategy Strong ,316.0209045410156
2018-03-15,BA,Boeing  About To Bring Down The Dow If Rising Support Breaks,316.0209045410156
2018-03-15,BA,Kudlow Plunges Into New Role as Trump s Warrior on U S  Economy,316.0209045410156
2018-03-15,BA,India eyes Super Hornet for Air Force,316.0209045410156
2018-03-15,BA,India eying Boeing s Super Hornet in latest twist to air force procurement,316.0209045410156
2018-03-15,BA,Trade War Theme Dominates Markets  Dollar Stays Weak ,316.0209045410156
2018-03-16,BA,Boeing 737 Max 7 narrowbody jetliner makes maiden flight,316.49017333984375
2018-03-16,BA,Top 5 Things That Moved Markets This Past Week,316.49017333984375
2018-03-16,BA,Boeing moves to keep 777X on track after engine snag,316.49017333984375
2018-03-19,BA,U S  stocks lower at close of trade  Dow Jones Industrial Average down 1 35 ,317.72564697265625
2018-03-20,BA,UAE seeks exemption from U S  tariffs on steel  aluminum  government official,323.3472900390625
2018-03-20,BA,Exclusive  Trump to boost exports of lethal drones to more U S  allies,323.3472900390625
2018-03-20,BA,Wall Street edges up on energy bump  Facebook slide continues,323.3472900390625
2018-03-20,BA,Stock Market News For Mar 21  2018,323.3472900390625
2018-03-20,BA,Why Value Investors Should Consider Boeing  BA  Right Now,323.3472900390625
2018-03-20,BA,ETFs To Be Impacted By Potential Trade War With China,323.3472900390625
2018-03-20,BA,McClatchy adds Boeing s Farr as chief accounting officer,323.3472900390625
2018-03-21,BA,China Southern places  3 6 billion Boeing 737 MAX order for Xiamen Airlines subsidiary,322.8397521972656
2018-03-21,BA,Southwest Airlines  4  after lowering Q1 RASM outlook,322.8397521972656
2018-03-21,BA,8 Must Watch ETFs If Trump Slams Tariffs On China By Friday ,322.8397521972656
2018-03-21,BA,U S  makes contingency plans in case Iran nuclear talks fail,322.8397521972656
2018-03-21,BA,As more ultra long haul flights lift off  prices for other routes sink,322.8397521972656
2018-03-22,BA,Stocks tumble to worst day in six weeks after Trump tariff action,306.089599609375
2018-03-22,BA,Elbit approval for Universal Avionics,306.089599609375
2018-03-22,BA,Will Trade War   Inflation Worries Spoil Dow ETF Party ,306.089599609375
2018-03-22,BA,Boeing will not appeal trade case against Bombardier  spokesman,306.089599609375
2018-03-22,BA,Day Ahead  Top 3 Things to Watch ,306.089599609375
2018-03-22,BA,These 3 Stocks Surged During Thursday s Sell Off  ,306.089599609375
2018-03-22,BA,Little sign of trade war panic in European equities,306.089599609375
2018-03-22,BA,Norway plans to buy electric planes  mimicking green car success,306.089599609375
2018-03-22,BA,Aerospace   Defense Industry Outlook   March 2018,306.089599609375
2018-03-22,BA,A New Fed Chair Shapes The Market s Outlook,306.089599609375
2018-03-22,BA,Boeing loyalist Ryanair to fly first Airbus with Austria deal,306.089599609375
2018-03-23,BA,U S  Aerospace   Defense To Soar On Budget  Air Traffic,307.4207763671875
2018-03-23,BA,Boeing set to win American wide body jet order  sources,307.4207763671875
2018-03-23,BA,Boeing nears widebody jet order from American after Airbus ends talks,307.4207763671875
2018-03-23,BA,Canada calls end to trade case positive for  longstanding  Boeing ties,307.4207763671875
2018-03-23,BA,Bloomberg  Rolls Royce engine problem extends from Boeing to Airbus A330,307.4207763671875
2018-03-23,BA,Rolls Royce says Trent 7000 engines not affected by turbine blade issues,307.4207763671875
2018-03-23,BA,Extent of U S  China trade fight depends on Trump s goals,307.4207763671875
2018-03-26,BA,Boeing Remains A Buy For ValuEngine,315.05364990234375
2018-03-26,BA,U S   EU to expel more than 100 Russian diplomats over UK nerve attack,315.05364990234375
2018-03-26,BA,GKN promises quick cash for investors as takeover battle comes to a head,315.05364990234375
2018-03-26,BA,Why Did Boeing  BA  Stock Pop On Monday ,315.05364990234375
2018-03-26,BA,Will Trade Worries Hurt Aerospace   Defense Growth ,315.05364990234375
2018-03-26,BA,Market Update  Complacency Reigns Supreme,315.05364990234375
2018-03-26,BA,Lockheed  LMT  Wins  54M Deal To Aid THAAD Missile System,315.05364990234375
2018-03-26,BA,Boeing completes Dreamliner family with first 787 10 delivery,315.05364990234375
2018-03-27,BA,3 Dow Stocks To Buy Amid Tech Selloff,307.5356750488281
2018-03-27,BA,Raytheon  RTN  Wins  85M Deal To Supply H 60 Spare Parts,307.5356750488281
2018-03-27,BA,Airline Stock Roundup  LUV s Bleak Q1 RASM View  UAL s Expansion Update   More,307.5356750488281
2018-03-27,BA,Boeing Wins Navy Deal To Support F A And EA 18 Aircraft ,307.5356750488281
2018-03-27,BA,Saudi Arabia to sign memorandum with Boeing to support fleet,307.5356750488281
2018-03-27,BA,When 2 Are Fighting  Gold Wins,307.5356750488281
2018-03-27,BA,When Countries Fight  Gold Wins,307.5356750488281
2018-03-27,BA,Top Stock Reports For Boeing  Texas Instruments   Bristol Myers,307.5356750488281
2018-03-28,BA,Greece s Aegean Air aims higher with  5 billion Airbus jet order,306.48223876953125
2018-03-28,BA,Raytheon  RTN  To Gain From US Poland  4 8B Deal For Patriot,306.48223876953125
2018-03-28,BA,Boeing said detected limited intrusion of malware,306.48223876953125
2018-03-29,BA,Barclays weighs in on aerospace   defense,314.0097351074219
2018-03-29,BA,Can U S  Exporters Survive China s Retaliatory Tariffs ,314.0097351074219
2018-03-29,BA,United Continental Arm To Expand Houston Havana Service,314.0097351074219
2018-03-29,BA,Boeing  BA  Wins  1 2B Deal To Support Kuwait s F A 18 Jets,314.0097351074219
2018-04-02,BA,General Dynamics New Offer For CSRA Outbids CACI ,308.79986572265625
2018-04-02,BA,Boeing Wins  430M Deal For Maintenance Support Of F A 18 Jets,308.79986572265625
2018-04-02,BA,Chart Of The Day  Gold May Be Signaling The Next Stock Selloff,308.79986572265625
2018-04-03,BA,Lockheed  LMT  Wins  279M FMS Contract For PAC 3 Missiles,316.82537841796875
2018-04-03,BA,Boeing To Deliver 75 737 Max Jets Worth  8 8B To Jet Airways ,316.82537841796875
2018-04-03,BA,Amazon finishes higher despite Trump s new threat on shipping rates,316.82537841796875
2018-04-04,BA,Company News For April 5  2018,313.5883483886719
2018-04-04,BA,India s Jet Airways agrees to buy 75 Boeing 737 MAX jets worth  8 8 billion,313.5883483886719
2018-04-04,BA,Boeing  BA  Wins  312M Air Force Contract For JDAM Tail Kits,313.5883483886719
2018-04-04,BA,U S  Leaves Door Open to China Talks Amid Trade War Fears,313.5883483886719
2018-04-04,BA,U S  Leaves Door Open to Talks With China Amid Trade War Fears,313.5883483886719
2018-04-04,BA,Should You Invest In The Fidelity MSCI Industrials Index ETF  FIDU  ,313.5883483886719
2018-04-04,BA,Wall Street closes higher as China tariff fears ease,313.5883483886719
2018-04-04,BA,Jet weight puzzle to determine China tariff impact on Boeing,313.5883483886719
2018-04-04,BA,Risk Appetite Recovers Despite U S  Tariff News  Eurozone Inflation In Focus,313.5883483886719
2018-04-04,BA,Stock Markets And A Civilized Trade Solution,313.5883483886719
2018-04-04,BA,China Slaps Tariffs  Dollar Dives ,313.5883483886719
2018-04-04,BA,Is FANG Cheap ,313.5883483886719
2018-04-04,BA,What Boeing Saudi Latest Tie Up Means For US Defense Majors,313.5883483886719
2018-04-04,BA,Top 5 Things to Know in the Market on Wednesday,313.5883483886719
2018-04-05,BA,Lockheed Martin  LMT  Wins  117M Contract For LRFD Delivery,322.1693115234375
2018-04-05,BA,Boeing  American Airlines Ink  12B Deal For 47 Dreamliners,322.1693115234375
2018-04-05,BA,Stock Market News For Apr 9  2018,322.1693115234375
2018-04-05,BA,L3 Technologies Wins Deal To Upgrade F A 18   EA 18 Jets,322.1693115234375
2018-04-05,BA,Kudlow  China Push Time to Talk Message Amid Trade Tension,322.1693115234375
2018-04-05,BA,China s  50B Tariff Backlash Puts These ETF Areas In Focus,322.1693115234375
2018-04-06,BA,Boeing wins American Airlines  widebody jet order,312.3241882324219
2018-04-06,BA,Special Report  How a secret Russian airlift helps Syria s Assad,312.3241882324219
2018-04-06,BA,Wall Street ends down 2 percent as trade worries mount,312.3241882324219
2018-04-06,BA,Defense Stock Roundup  BA  RTN Win Deals  GD Closes CSRA Buyout,312.3241882324219
2018-04-06,BA,Special Report  How a secret Russian airlift helps Syria s Assad,312.3241882324219
2018-04-06,BA,India opens contest for more than 100 fighter jets,312.3241882324219
2018-04-06,BA,Trump threatens more China tariffs  Beijing ready to hit back,312.3241882324219
2018-04-09,BA,Boeing Wins F 15SA Deal For Cumulative Face Value Of  305M,308.83819580078125
2018-04-09,BA,An Antidote To Global Trade Jitters  Check Out These Buying Options,308.83819580078125
2018-04-09,BA,Stock Market News For Apr 10  2018,308.83819580078125
2018-04-10,BA,Boeing  BA  Q1 Commercial Deliveries Up Y Y  Defense Slips,320.66571044921875
2018-04-10,BA,Spirit AeroSystems exits MRO joint venture in China,320.66571044921875
2018-04-10,BA,Indonesia s Lion Air announces purchase of 50 Boeing 737 MAX 10 jets,320.66571044921875
2018-04-10,BA,Stock Market News For Apr 11  2018,320.66571044921875
2018-04-10,BA,Malaysia Airlines launches widebody tender process  could oust Boeing 787 deal  source,320.66571044921875
2018-04-10,BA,Exclusive  Airbus suspends A320 revamp study amid output problems,320.66571044921875
2018-04-10,BA,Boeing first quarter plane deliveries rise 9 percent  orders ahead of Airbus,320.66571044921875
2018-04-10,BA,Boeing orders ahead of Airbus in Q1,320.66571044921875
2018-04-11,BA,3 Restaurant Stocks To Keep Trade War Tensions Off The Menu ,313.51171875
2018-04-11,BA,Bombardier delivered five CSeries in first quarter as delays ease  sources,313.51171875
2018-04-11,BA,Orbital ATK  OA  Receives Order For Small Caliber Ammunition,313.51171875
2018-04-11,BA,Boeing  Lion Air Group Ink  6 2B Deal For 50 737 MAX 10 Jets,313.51171875
2018-04-11,BA,Airbus sees backloaded deliveries in 2018  reaffirms target,313.51171875
2018-04-11,BA,Northrop Grumman s Unit Wins  210M Deal To Support LAIRCM,313.51171875
2018-04-11,BA,Emerging Markets  What Changed,313.51171875
2018-04-12,BA,General Dynamics  GD  Wins  144M US BICES X Maintenance Deal,323.20361328125
2018-04-12,BA,Norway s Wideroe says may increase Embraer jet order,323.20361328125
2018-04-12,BA,Rolls Royce and Boeing back UK minnow s rocket engine technology,323.20361328125
2018-04-12,BA,Embraer and Boeing discussing a commercial aviation alliance,323.20361328125
2018-04-12,BA,Boeing Embraer proposal brings tie up closer  not imminent  sources,323.20361328125
2018-04-13,BA,Analyst Who Called  98 Russia Crash Says Stock Outlook Is  Grim ,315.35052490234375
2018-04-13,BA,Rolls Royce ups estimate to fix Boeing Dreamliner engines,315.35052490234375
2018-04-16,BA,AirAsia X won t buy  too expensive  Airbus A350  co group CEO,317.7352294921875
2018-04-16,BA,3 Defense Picks If Russia Intervenes In U S  Syria Crisis,317.7352294921875
2018-04-16,BA,Embraer s  ERJ  Q1 Deliveries Decline Y Y  Backlog Slips,317.7352294921875
2018-04-16,BA,China tariffs on U S  business jets no clear boost to rivals  aviation executives,317.7352294921875
2018-04-17,BA,Exclusive  Amazon in talks with airline Azul for shipping in Brazil   sources,322.4757995605469
2018-04-17,BA,Airlines back creation of global drone registry  IATA,322.4757995605469
2018-04-17,BA,Arming the world  Inside Trump s  Buy American  drive to expand weapons exports,322.4757995605469
2018-04-17,BA,Raytheon  RTN  Hits Fresh Highs  Is There Still Room To Run ,322.4757995605469
2018-04-17,BA,Lockheed Martin Wins  200M Deal To Upgrade THAAD And PATRIOT,322.4757995605469
2018-04-17,BA,Raytheon Wins  83M Barracuda Mine Neutralization System Deal,322.4757995605469
2018-04-17,BA,Textron  TXT  Tops Q1 Earnings Estimate  Keeps  18 EPS View,322.4757995605469
2018-04-17,BA,Brazil secures WTO backing in dispute with Canada s Bombardier,322.4757995605469
2018-04-18,BA,Korean Air to inspect engines of Boeing 737 fleet by November  official,326.57476806640625
2018-04-18,BA,Lockheed teams up with more German firms on military helicopter bid,326.57476806640625
2018-04-18,BA,Lockheed Martin Wins  928M Hypersonic Strike Weapon Contract,326.57476806640625
2018-04-18,BA,Can Order   Cash Flow Growth Aid Boeing s  BA  Q1 Earnings ,326.57476806640625
2018-04-18,BA,Airlines inspecting Boeing 737 engines after fatal Southwest incident,326.57476806640625
2018-04-18,BA,U S  inspectors probe deadly Southwest jet engine explosion,326.57476806640625
2018-04-19,BA,FAA to order inspections of jet engines after Southwest blast,326.22998046875
2018-04-19,BA,Trump launches effort to boost U S  weapons sales abroad,326.22998046875
2018-04-19,BA,GE Rated SELL In The Aftermath Of Southwest Incident,326.22998046875
2018-04-19,BA,General Dynamics   GD  Q1 Earnings  Is A Beat In The Offing ,326.22998046875
2018-04-19,BA,Textron  TXT  Catches Eye  Stock Jumps 6 8 ,326.22998046875
2018-04-20,BA,Southwest giving passengers  5 000 checks on accident flight,324.34332275390625
2018-04-20,BA,Exclusive  Lockheed Martin to propose stealthy hybrid of F 22 and F 35 for Japan   sources,324.34332275390625
2018-04-20,BA,Will Higher 737 Deliveries Drive Boeing s  BA  Q1 Earnings ,324.34332275390625
2018-04-20,BA,Boeing  Brazil s Embraer close to tie up  report,324.34332275390625
2018-04-20,BA,Reuters  GE Aviation engines chosen by Turkish Airlines for new planes,324.34332275390625
2018-04-20,BA,European agency orders expanded Boeing 737 engine checks after accidents,324.34332275390625
2018-04-20,BA,Can Order Growth Drive Lockheed Martin s  LMT  Q1 Earnings ,324.34332275390625
2018-04-23,BA,Will Missile Systems Unit Drive Raytheon  RTN  Q1 Earnings ,324.5061340332031
2018-04-23,BA,Zacks com Featured Highlights Include  Caterpillar  Boeing  WellCare  BlackBerry And Amazon,324.5061340332031
2018-04-23,BA,An Airline ETF For Those Seeking Profit Margins,324.5061340332031
2018-04-23,BA,Lockheed  LMT  Beats On Q1 Earnings  Raises  18 Guidance,324.5061340332031
2018-04-23,BA,Connecting The Dots Of Big Data  Soaring Corporate Profits  Trade Wars ,324.5061340332031
2018-04-23,BA,Will F A 18 Order Growth Boost Boeing s  BA  Q1 Earnings ,324.5061340332031
2018-04-23,BA,Some U S  allies caught in crossfire of sanctions on Russian arms,324.5061340332031
2018-04-23,BA,Amazon Roundup  Prime Reaches 100 Million  Best Buy Deal   More,324.5061340332031
2018-04-23,BA,Can Aerospace Unit Fuel Northrop Grumman  NOC  Q1 Earnings ,324.5061340332031
2018-04-24,BA,Defense Stocks To Short,315.1398010253906
2018-04-24,BA,Japan seeks role in French German marine surveillance plane project  sources,315.1398010253906
2018-04-24,BA,A Funny Thing Happened On The Way To Q1 Earnings   ,315.1398010253906
2018-04-24,BA,Should You Buy Boeing  BA  Ahead Of Earnings ,315.1398010253906
2018-04-24,BA,German defense ministry gets bids for Tornado fighter jet replacement,315.1398010253906
2018-04-24,BA,Boeing Crosses Key Trendline Ahead Of Earnings,315.1398010253906
2018-04-24,BA,Lockheed lauds U S  arms sales push  sees foreign sales rising,315.1398010253906
2018-04-24,BA,Ryanair agrees to buy 25 more Boeing 737 MAX planes,315.1398010253906
2018-04-24,BA,Day Ahead  Top 3 Things to Watch ,315.1398010253906
2018-04-24,BA,Should You Buy Boeing  BA  Stock Ahead Of Earnings ,315.1398010253906
2018-04-25,BA,Boeing cruises past forecasts as margins  sales grow,328.3560485839844
2018-04-25,BA,Boeing  BA  Beats On Q1 Earnings And Revenue Estimates,328.3560485839844
2018-04-25,BA,Top 5 Things to Know in the Market on Wednesday,328.3560485839844
2018-04-25,BA,Big data aids Sikorsky in improving helicopter maintenance,328.3560485839844
2018-04-25,BA,U S  Treasury yield curve flattening to intensify with U S  pension plan bond buying,328.3560485839844
2018-04-25,BA,Rolls Royce  Airbus to collaborate on new UltraFan engine,328.3560485839844
2018-04-25,BA,Stocks  U S  Futures Fall as Bond Yields Rise,328.3560485839844
2018-04-25,BA,Eurofighter urges U S  not use nuclear certification to  leverage  German jets bid,328.3560485839844
2018-04-25,BA,Boeing adds German partners for heavy lift helicopter battle,328.3560485839844
2018-04-25,BA,Financial  tech stocks lead Wall Street lower as yields rise,328.3560485839844
2018-04-26,BA,Rockwell Collins  COL  Beats On Q2 Earnings  Sales Up Y Y,328.28900146484375
2018-04-26,BA,Bear Market Characteristics Show Up,328.28900146484375
2018-04-26,BA,US Market Rebounds On Positive Reports,328.28900146484375
2018-04-26,BA,5 Solid Stocks To Buy On Robust Durable Orders ,328.28900146484375
2018-04-26,BA,Boeing s Big Bounce Buoys Dow Jones Industrial Average,328.28900146484375
2018-04-26,BA,iFOREX Daily Analysis   April 26 2018,328.28900146484375
2018-04-26,BA,U S  Corporate Earnings Buoy Global Equities Despite 3  U S  Yields,328.28900146484375
2018-04-26,BA,U S  Durable Goods Orders Rise More Than Forecast In March,328.28900146484375
2018-04-26,BA,CFM says more than half of engines inspected after emergency directive,328.28900146484375
2018-04-26,BA,U S  core capital goods orders  shipments fall in March,328.28900146484375
2018-04-27,BA,Airbus cuts A330 output  first quarter profit capped by engine delays,326.4598083496094
2018-04-27,BA,Passenger sues Southwest Airlines over fatal engine explosion,326.4598083496094
2018-04-27,BA,Better battery packaging on planes overlooks other safety concerns  airlines,326.4598083496094
2018-04-27,BA,Southwest Airlines orders 40 Boeing 737 MAX jets worth  4 68 billion,326.4598083496094
2018-04-30,BA,Demand For 737 To Aid Spirit AeroSystem s  SPR  Q1 Earnings,319.4494323730469
2018-04-30,BA,Embraer  ERJ  Misses Q1 Earnings Estimates  Keeps  18 View,319.4494323730469
2018-04-30,BA,The Zacks Analyst Blog Highlights  Boeing  Lockheed Martin  Wesco Aircraft Holdings  CPI Aerostructures And Rockwell Collins,319.4494323730469
2018-05-01,BA,Israel postpones U S  based test of Arrow 3,315.5995178222656
2018-05-01,BA,Boeing to buy aerospace parts maker KLX for about  3 2 billion,315.5995178222656
2018-05-01,BA,Premarket Losers as of 9 05 am  5 1 2018 ,315.5995178222656
2018-05-01,BA,Spirit AeroSystems  SPR  Q1 Earnings Miss  Revenues Up Y Y,315.5995178222656
2018-05-01,BA,Gogo  GOGO  To Report Q1 Earnings  What s In The Cards ,315.5995178222656
2018-05-01,BA,Tax activists slam U S  reporting exemption for defense firms,315.5995178222656
2018-05-02,BA,First NASA lander to study Mars  interior due for California launch,310.4758605957031
2018-05-02,BA,First NASA lander to study Mars  interior launches from California,310.4758605957031
2018-05-02,BA,Should You Invest In The IShares Global Industrials ETF  EXI  ,310.4758605957031
2018-05-02,BA,United allows pets back onto flights,310.4758605957031
2018-05-02,BA,Southwest jet makes emergency stop in Cleveland with cracked window,310.4758605957031
2018-05-02,BA,Exclusive  UTC set to win EU approval for  23 billion Rockwell Collins deal   sources,310.4758605957031
2018-05-03,BA,Rolls Royce says working quickly to fix Trent 1000 problems,316.70086669921875
2018-05-03,BA,U S  Factory Orders Remain Strong In March  5 Top Picks,316.70086669921875
2018-05-03,BA,Planemakers risk order disruption as Etihad reviews strategy,316.70086669921875
2018-05-04,BA,Spacecraft for detecting  Marsquakes  set for rare California launch,320.28265380859375
2018-05-04,BA,UTC gains EU antitrust approval to buy Rockwell Collins,320.28265380859375
2018-05-04,BA,Brazil military airlifts Venezuelan migrants as border crisis grows,320.28265380859375
2018-05-07,BA,Fasten your seatbelts  WTO prepares to land Airbus ruling,326.02880859375
2018-05-07,BA,U S  stocks higher at close of trade  Dow Jones Industrial Average up 0 39 ,326.02880859375
2018-05-08,BA,Economic Data   More,324.05596923828125
2018-05-08,BA,Uber  U S  Army ally to test quiet aircraft technology,324.05596923828125
2018-05-08,BA,Exclusive  United Airlines in talks to buy wide body jets   sources,324.05596923828125
2018-05-08,BA,Exclusive  Emirates facing cabin crew shortages   sources,324.05596923828125
2018-05-08,BA,U S  Treasury s Mnuchin  Revoking Boeing  Airbus licenses to sell jets to Iran,324.05596923828125
2018-05-08,BA,PPI Just  0 1   Boeing To Take Hit From Iran Pullout,324.05596923828125
2018-05-09,BA,Boeing CEO says end of Iran deal won t hurt 737 production,329.92669677734375
2018-05-09,BA,Europeans work to save Iran deal  and business  after Trump pulls out,329.92669677734375
2018-05-09,BA,Oil Surges  Dollar Gains Extended Post Withdrawal Announcement,329.92669677734375
2018-05-09,BA,Boeing CEO Downplays Impact of Trump Canceling Iran Licenses,329.92669677734375
2018-05-09,BA, Defense Stock Roundup  LLL Tops  SPR   HII Lag Q1 Estimates  BA To Buy KLX,329.92669677734375
2018-05-09,BA,Iran Was a Hard Sell for Bankers Before Trump,329.92669677734375
2018-05-09,BA,U S  exit from Iran deal puts pressure on European planemakers,329.92669677734375
2018-05-09,BA,Tearing Up The Dollar  ,329.92669677734375
2018-05-09,BA,Siemens  PSA and Airbus monitoring Iran developments after Trump move,329.92669677734375
2018-05-09,BA,More pressure seen on Airbus than Boeing from U S  Iran deal exit,329.92669677734375
2018-05-10,BA,China to deliver world s largest amphibious aircraft by 2022  Xinhua,331.1585998535156
2018-05-10,BA,SpaceX postpones first commercial launch of updated Falcon 9 rocket,331.1585998535156
2018-05-10,BA,Brexit seen threatening UK links in EU supply chain,331.1585998535156
2018-05-10,BA,Defense Stocks Rally On Iran Deal  4 Hot Picks,331.1585998535156
2018-05-10,BA,Embraer breakup complications are delaying its deal with Boeing  sources,331.1585998535156
2018-05-10,BA,Embraer sticks to KC 390 delivery timeline,331.1585998535156
2018-05-11,BA,Iran says Airbus to announce its decision on selling planes to Tehran soon  Fars,329.6090087890625
2018-05-11,BA,SpaceX launches new rocket primed for future crewed missions,329.6090087890625
2018-05-11,BA,Europe moves to safeguard interests in Iran after U S  pullout,329.6090087890625
2018-05-14,BA,Why You Should Hold Genpact  G  Stock Right Now,331.6590881347656
2018-05-14,BA,Japan Airlines to set up low cost carrier  targeting Asian demand,331.6590881347656
2018-05-15,BA,Wolfe cashes in some chips on TransDigm,329.28179931640625
2018-05-15,BA,Northrop Grumman  NOC  Approves 9  Increase In Dividend,329.28179931640625
2018-05-16,BA,How Rusal escaped the noose of U S  sanctions,328.1749267578125
2018-05-16,BA,Cuba confirms 110 killed in country s deadliest plane crash since 1989,328.1749267578125
2018-05-16,BA,China agrees to import more from U S   no sign of  200 billion figure,328.1749267578125
2018-05-17,BA,Is Boeing  BA  Stock Outpacing Its Aerospace Peers This Year ,331.22601318359375
2018-05-17,BA,China offering Trump package to slash U S  trade deficit  officials say,331.22601318359375
2018-05-17,BA,U S  s Iran Sanctions Also Impact European Firms  What s At Stake,331.22601318359375
2018-05-17,BA,Stock Market News For May 21  2018,331.22601318359375
