date,ticker,news,close_price
2016-11-02,BA,Amid South China Sea tension  defense exporters flock to Indonesia,129.50091552734375
2016-11-02,BA,U S  EXIM jet financing could resume in December  official says,129.50091552734375
2016-11-03,BA,Boeing wins  479 million U S  defense contract  Pentagon,128.82928466796875
2016-11-07,BA,Exclusive  FedEx grounds one plane over GE engine part concern,131.59872436523438
2016-11-07,BA,Singapore to buy Airbus and Boeing helicopters,131.59872436523438
2016-11-08,BA,Airbus sold 19 jets in October,131.8397674560547
2016-11-08,BA,Boeing still holds net order lead for 2016,131.8397674560547
2016-11-08,BA,Defense Stock Roundup  Q3 Earnings Beat At LDOS  Miss At HII  Big Wins At BA  BAESY   RTN,131.8397674560547
2016-11-09,BA,Trump and the defense sector,134.5192108154297
2016-11-09,BA,What s In The Cards For Stratasys  SSYS  In Q3 Earnings ,134.5192108154297
2016-11-09,BA,U S  arms export boom under Obama seen continuing with Trump,134.5192108154297
2016-11-09,BA,U S  aerospace and defense industry welcomes Trump victory,134.5192108154297
2016-11-09,BA,U S  companies react cautiously to Trump victory,134.5192108154297
2016-11-09,BA,ViaSat  8 7  as American Airlines boosts order  Gogo  4 5 ,134.5192108154297
2016-11-09,BA,Boeing congratulates Trump  congressional leaders on victories,134.5192108154297
2016-11-09,BA,Trump victory shocks global firms reliant on open trade,134.5192108154297
2016-11-11,BA,Once critical  Gulf executives want to do business with Trump,137.6993408203125
2016-11-14,BA,Alaska Airlines Makes Premium Class Booking Available,139.0622100830078
2016-11-14,BA,The Zacks Analyst Blog Highlights  Arotech  Engility Holdings  Northrop Grumman And Hexcel,139.0622100830078
2016-11-14,BA,Obama promises to veto bill that would block aircraft exports to Iran,139.0622100830078
2016-11-14,BA,Watch These 5 Stocks,139.0622100830078
2016-11-15,BA,Boeing to revamp defense  space and security business,137.31918334960938
2016-11-15,BA,United to restrict low fare flyers to one carry on bag,137.31918334960938
2016-11-15,BA,United Continental postpones delivery of Boeing 737 jets,137.31918334960938
2016-11-15,BA,Boeing says still expects to raise 737 output after United fleet changes,137.31918334960938
2016-11-15,BA,Boeing shares fall as United Airlines defers 737 order,137.31918334960938
2016-11-15,BA,Trump s Impact After 1 Week,137.31918334960938
2016-11-15,BA,Boeing to cut defense jobs in consolidation effort,137.31918334960938
2016-11-15,BA,Airline News  Alaska s Tree Based Jet Fuel  United s Basic Economy Fare,137.31918334960938
2016-11-16,BA,Alaska Airlines To Start Flights Between San Diego   Baltimore,135.7708740234375
2016-11-17,BA,Emirates crash investigation to take up to three years  regulator,134.74172973632812
2016-11-17,BA,U S  House votes to bar sales of commercial aircraft to Iran,134.74172973632812
2016-11-17,BA,House votes to ban sale of commercial aircraft to Iran,134.74172973632812
2016-11-17,BA,Airbus to announce  significant order ,134.74172973632812
2016-11-18,BA,Boeing fighter jet sales worth up to  31B advance toward final approval,135.6874237060547
2016-11-18,BA,AAR Corp And Air New Zealand Sign PBH Partnership Deal,135.6874237060547
2016-11-18,BA,Defense Stock Roundup  Lockheed Martin  Raytheon  Leidos Win DoD Contracts,135.6874237060547
2016-11-18,BA,Manufacturing Reshoring Ahead  ETFs To Profit,135.6874237060547
2016-11-21,BA,Copa Holdings And Andersons Highlighted As Zacks Bull And Bear Of The Day ,136.30857849121094
2016-11-21,BA,Boeing  BA  Hits 52 Week High On Steady Flow Of Contracts,136.30857849121094
2016-11-21,BA,Thales  The Ugly Duckling Has Become A Swan ,136.30857849121094
2016-11-21,BA,Airbus s largest A350 jet carries out its maiden flight,136.30857849121094
2016-11-21,BA,4 Trades To Fly Higher With Boeing  Bonus Idea,136.30857849121094
2016-11-21,BA,Boeing taps GE exec to head airplanes unit as part of services push,136.30857849121094
2016-11-22,BA,Pakistan s PIA considers Boeing  Airbus jets for fleet upgrade,138.62646484375
2016-11-22,BA,U S  stocks higher at close of trade  Dow Jones Industrial Average up 0 35 ,138.62646484375
2016-11-22,BA,Exclusive  U S  grants second Airbus license to sell planes to Iran,138.62646484375
2016-11-22,BA,Alaska Airlines Launches San Diego To Newark Flight,138.62646484375
2016-11-22,BA,Bell Boeing JV Wins  267M Navy Deal For CV 22  MV 22 Jets,138.62646484375
2016-11-22,BA,Look At Thanksgiving,138.62646484375
2016-11-22,BA,Durable Goods Rise  Thanksgiving Costs Fall,138.62646484375
2016-11-23,BA,Quebec aerospace industry expects benefits from Boeing jet deal,138.83041381835938
2016-11-23,BA,Defense Stock Roundup  Lockheed Martin Scores Big  Boeing  Textron  General Dynamics Make A Mark,138.83041381835938
2016-11-23,BA,SpaceX seeks U S  approval for internet via satellite network,138.83041381835938
2016-11-23,BA,Iran warns of retaliation if U S  breaches nuclear deal,138.83041381835938
2016-11-23,BA,U S  weather satellite s launch promises  quantum leap  in forecasts,138.83041381835938
2016-11-25,BA,Turkey s Pegasus may postpone Boeing deliveries as costs weigh  CEO says,139.10855102539062
2016-11-25,BA,Enthusiasts lose one vintage plane but press on south through Africa,139.10855102539062
2016-11-28,BA,L 3 Communications Hits 52 Week High On Prudent Buyouts,138.8582305908203
2016-11-28,BA,Spirit Aero Systems Scales 52 Week High On Upbeat Outlook,138.8582305908203
2016-11-28,BA,USD Reverses As Traders Doubt  Trumpflation ,138.8582305908203
2016-11-28,BA,Kuwait plans to buy 28 Boeing F 18 jets  official says,138.8582305908203
2016-11-28,BA,Norway plans  1 15 billion order for five Boeing Poseidon military aircraft,138.8582305908203
2016-11-28,BA,WTO rules against tax break for Boeing 777X jet,138.8582305908203
2016-11-29,BA,Huntington Ingalls Hits 52 Week High On Defense Prospects,140.59201049804688
2016-11-30,BA,Boeing Unit Wins  559M Air Force Contract To Upgrade Radars,139.59066772460938
2016-11-30,BA,France says U S  must comply fast with WTO Boeing ruling,139.59066772460938
2016-12-01,BA,U S  Navy aims to buy more Boeing F A 18E F Super Hornets  source,141.28733825683594
2016-12-01,BA,Boeing Lockheed JV Unit Secures  269M Air Force Contract,141.28733825683594
2016-12-02,BA,Trump moves to quickly fill his top Cabinet ranks,141.15756225585938
2016-12-02,BA,Norway urges Trump to issue predictable  clear policy on Russia,141.15756225585938
2016-12-02,BA,Week In Review  Don t Get Trampled By This Bull Market,141.15756225585938
2016-12-02,BA,Iran says U S  extension of sanctions act violates nuclear deal,141.15756225585938
2016-12-06,BA,Triumph Group Prospects Bright  Price Volatility A Drag,141.1482696533203
2016-12-06,BA,Trump on Boeing s Air Force One contract   Cancel order  ,141.1482696533203
2016-12-06,BA,Will Trump s Tweet Hurt Boeing s Air Force One Deal ,141.1482696533203
2016-12-06,BA,Northrop  NOC  Wins  15M Navy Deal For Support Services,141.1482696533203
2016-12-06,BA,Boeing expects business jet sales to recover in next two years,141.1482696533203
2016-12-07,BA,Trump vows to bring down drug prices  doesn t say how,142.9098663330078
2016-12-07,BA,Trump defends Boeing tweet  says companies shouldn t worry,142.9098663330078
2016-12-07,BA,Market Update   07 12 2016,142.9098663330078
2016-12-07,BA,Will Trump s Victory Spell Doom For Lockheed Martin s F 35  ,142.9098663330078
2016-12-08,BA,Iran seals  17 billion Boeing deal  close to Airbus order,144.06878662109375
2016-12-08,BA,Iran signs  16 6 billion deal for 80 Boeing planes  IRNA,144.06878662109375
2016-12-08,BA,Boeing  BA  787 10 Ready For Next Phase  Final Assembly On,144.06878662109375
2016-12-08,BA,Time To Take Trump Seriously On Infrastructure Spending ,144.06878662109375
2016-12-08,BA,Defense Stock Roundup  Boeing  Lockheed Martin Steal The Show  United Tech Clinches A Big Win,144.06878662109375
2016-12-08,BA,U S  futures point to steady open as markets pause,144.06878662109375
2016-12-08,BA,EU bans Iran s Aseman Airlines from flying in Europe,144.06878662109375
2016-12-08,BA,Will Boeing Hike Dividend By 30  As Per Morgan Stanley ,144.06878662109375
2016-12-09,BA,Giuliani pulls out of consideration to serve in administration  Trump,145.08865356445312
2016-12-09,BA,Trump calls for ethics reform of defense contracting,145.08865356445312
2016-12-09,BA,Trump floats ban on defense firms hiring military procurement officials,145.08865356445312
2016-12-12,BA,Boeing to cut 777 production rate by 40 percent in August 2017,145.70982360839844
2016-12-12,BA,Market Update  12 12 2016,145.70982360839844
2016-12-12,BA,Fed turns to Trump agenda with rate hike nearly in the bag,145.70982360839844
2016-12-12,BA,Trump tweets that the F 35 s cost is  out of control    and now the stock of the company that makes them is diving,145.70982360839844
2016-12-13,BA,Opening Bell  Fed Meets Today   Check Your Twitter Feed Now,145.24623107910156
2016-12-13,BA,Market Update   13 12 2016,145.24623107910156
2016-12-13,BA,Market taking Trump promises seriously  threats not literally  James Saft,145.24623107910156
2016-12-13,BA,Boeing to move defense unit headquarters to Washington  D C ,145.24623107910156
2016-12-13,BA,IranAir hopes to finalize Airbus deal in two weeks,145.24623107910156
2016-12-13,BA,Iran says Boeing to provide financing for firm s first six planes  Fars news agency,145.24623107910156
2016-12-14,BA,Investigators begin final sweep of MH370 search area,143.21583557128906
2016-12-14,BA,Trump says picks Mulvaney to be White House budget director,143.21583557128906
2016-12-14,BA,U S  grounds Osprey aircraft in Japan after Okinawa crash,143.21583557128906
2016-12-14,BA,Targeting U S  automaker signals possible China retaliation over Trump talk,143.21583557128906
2016-12-15,BA,S P 500 Futures  Perfect Storm  ESH17 2273 00,142.5668182373047
2016-12-15,BA,Israel s El Al looks to new planes to reassert dominance,142.5668182373047
2016-12-15,BA,Weekly Review  Markets  Mostly  Shrug Off Fed Hike,142.5668182373047
2016-12-15,BA,Regional jet makers eye China market boost but obstacles loom,142.5668182373047
2016-12-15,BA,New report advises Trump  Pentagon to  leverage  commercial RD,142.5668182373047
2016-12-15,BA,IranAir confirms cutting Airbus order  dropping A380s,142.5668182373047
2016-12-15,BA,5 Reasons The Fed Won t Even Hike Twice In 2017,142.5668182373047
2016-12-16,BA,United States appeals against latest WTO Boeing subsidies ruling,143.24363708496094
2016-12-19,BA,Exclusive  Iran to land first Airbus jet within weeks under sanctions pact,144.80125427246094
2016-12-19,BA,Boeing airplane unit to cut more jobs in 2017,144.80125427246094
2016-12-20,BA,Investigators urge extending search for missing Malaysian flight,144.9959259033203
2016-12-20,BA,Embraer calls for industry limits on aircraft development funding,144.9959259033203
2016-12-21,BA,Too Late To Join Boeing s Bull Party,146.0065155029297
2016-12-21,BA,Trump seeking  tremendous cuts  in price of Air Force One,146.0065155029297
2016-12-21,BA,Boeing CEO says he assured Trump about Air Force One costs,146.0065155029297
2016-12-21,BA,Currency markets mixed on Wednesday,146.0065155029297
2016-12-21,BA,Israel s Spacecom buys Boeing satellite for  161 million  to launch in 2019,146.0065155029297
2016-12-21,BA,U S  stocks lower at close of trade  Dow Jones Industrial Average down 0 16 ,146.0065155029297
2016-12-21,BA,Wall Street indexes closed lower on light trading,146.0065155029297
2016-12-22,BA,Airbus seals deal with Iran for sale of 100 aircraft,145.9879608154297
2016-12-22,BA,Iran sealed Boeing deal at half price,145.9879608154297
2016-12-22,BA,Trump extracts pledge from Boeing on Air Force One costs,145.9879608154297
2016-12-22,BA,Trump pressures Lockheed  says told Boeing to price out fighter aircraft,145.9879608154297
2016-12-23,BA,Lockheed CEO   Personally committed  to lowering F 35 cost,146.31246948242188
2016-12-23,BA,Lockheed Martin CEO commits to driving down F 35 fighter s costs,146.31246948242188
2016-12-23,BA,Lockheed CEO tells Trump she will work to drive down cost of F 35,146.31246948242188
2016-12-23,BA,Trump asks Boeing for price quote on new fighter  Lockheed shares sink,146.31246948242188
2016-12-23,BA,Buckingham calls Trump s bluff on F 35 alternative,146.31246948242188
2016-12-23,BA,Lockheed Martin bends to Trump s price demands,146.31246948242188
2016-12-27,BA,India s Jet Airways plane skids off Goa runway  12 hurt,146.0065155029297
2016-12-27,BA,Delta to cancel order for 18 Boeing 787 Dreamliner aircraft,146.0065155029297
2016-12-28,BA,Largest drop in two months as Wall St  rally loses steam,144.72708129882812
2016-12-29,BA,Dollar dips  Nikkei slugged by Toshiba selloff,144.34693908691406
2016-12-30,BA,Pole arrested after airliner makes emergency landing in Prague,144.33761596679688
2017-01-03,BA,Trump  Tweet Risk  Will Be Major Theme In 2017,145.53369140625
2017-01-03,BA,Trump assails GM over car production in Mexico  threatens tax,145.53369140625
2017-01-03,BA,Chided by Trump  Ford scraps Mexico factory  adds Michigan jobs,145.53369140625
2017-01-03,BA,DJIA moves higher  energized by Ford news,145.53369140625
2017-01-04,BA,Boeing inches toward goal with  8 25 billion order from GE,147.0634765625
2017-01-04,BA,2017 Key Market Themes,147.0634765625
2017-01-04,BA,S P 500 Futures  Day 3 Of 251 Trading Days In 2017 ,147.0634765625
2017-01-05,BA,Boeing nears  10 1 billion order from India s Spicejet  Bloomberg,147.1468963623047
2017-01-05,BA,Who s Afraid Of The Big  Bad  Tweeting Wolf ,147.1468963623047
2017-01-05,BA,Stars  plane makes emergency landing  smoke in cockpit,147.1468963623047
2017-01-06,BA,Boeing s 2016 orders lowest since 2010  deliveries hit target,147.5084991455078
2017-01-06,BA,Airbus reached A350 delivery target in 2016  sources,147.5084991455078
2017-01-09,BA,S P 500 Futures  Day 4 And New All Time Contract Highs ,146.7853240966797
2017-01-09,BA,Exclusive  Airbus may post 8 percent rise in 2016 deliveries  narrow gap with Boeing,146.7853240966797
2017-01-10,BA,Boeing  new lobby group aim to keep  8 7 billion in state tax breaks,147.48068237304688
2017-01-10,BA,Boeing internal memo sets details of engineer layoffs in 2017,147.48068237304688
2017-01-11,BA,IranAir takes delivery of first Airbus jet post sanctions,147.78660583496094
2017-01-11,BA,Airbus deliveries rose 8 percent  orders outpaced Boeing in 2016,147.78660583496094
2017-01-11,BA,U S  companies have new business risk   being labeled  anti American  by Trump,147.78660583496094
2017-01-12,BA,Trump s Press Conference Moves The Markets,146.75747680664062
2017-01-12,BA,India s SpiceJet to seal  10 billion deal with Boeing for 737 jets  sources,146.75747680664062
2017-01-12,BA,Market indexes show disappointment in Trump remarks,146.75747680664062
2017-01-12,BA,Why Are WMT And BA Laying Off Workers If The Economy Is In Good Shape ,146.75747680664062
2017-01-13,BA,Turkish cargo jet crash kills 37 in Kyrgyzstan,147.25816345214844
2017-01-13,BA,Kyrgyz neighborhood razed by plane crash,147.25816345214844
2017-01-13,BA,SpiceJet plots expansion with order for 100 new Boeing planes,147.25816345214844
2017-01-13,BA,Lockheed Martin CEO meets Trump  says deal to lower F 35 costs is close,147.25816345214844
2017-01-13,BA,Airbus versus Boeing  Iran deals the difference in plane battle,147.25816345214844
2017-01-13,BA,Trump  Lockheed Martin CEO to meet on Friday  transition official,147.25816345214844
2017-01-13,BA,Overseas ambitions  bumper plane orders test Vietnam s  bikini airline ,147.25816345214844
2017-01-17,BA,Boeing CEO sees  near term  plane deal after Trump meeting,146.18267822265625
2017-01-17,BA,Upbeat Boeing CEO says meeting with Trump  very productive ,146.18267822265625
2017-01-17,BA,Underwater search for missing Malaysian flight ends without a trace,146.18267822265625
2017-01-18,BA,Wall Street Week Ahead  Optimism among S P 500 CEOs as Trump takes power,146.7853240966797
2017-01-18,BA,Trump to name ex Georgia Governor Perdue as agriculture secretary,146.7853240966797
2017-01-18,BA,Israel deploys  Star Wars  missile killer system,146.7853240966797
2017-01-18,BA,Australia says suspended MH370 search could resume in future,146.7853240966797
2017-01-19,BA,Malaysia to offer reward for missing Flight MH370,147.41574096679688
2017-01-19,BA,Exclusive  Spirit AeroSystems mulls outsourcing U S  supply chain jobs  sources,147.41574096679688
2017-01-19,BA, TransDigm Group Stock  Falling Apart as Trump Takes Office,147.41574096679688
2017-01-19,BA,A New Administration ,147.41574096679688
2017-01-20,BA,Rockwell Collins sees defense market uptick  small 777 impact,147.90713500976562
2017-01-20,BA,Tech firm creates Trump monitor for stock markets,147.90713500976562
2017-01-20,BA,Machinists seek union vote for Boeing South Carolina workers,147.90713500976562
2017-01-23,BA,Malaysian minister meets MH370 relatives  group in Perth,146.3402862548828
2017-01-23,BA,Possible  400 million military sale to Britain approved  Pentagon,146.3402862548828
2017-01-23,BA,Why You Shouldn t Bet Against America,146.3402862548828
2017-01-24,BA,What s In Store For Boeing s Q4 Results ,148.85284423828125
2017-01-24,BA,High Uncertainty For Industrials Under Trump Administration ,148.85284423828125
2017-01-25,BA,No time to create walls between nations  Iran s Rouhani,155.16668701171875
2017-01-25,BA,Israel completes advanced testing of mid range missile interceptor,155.16668701171875
2017-01-25,BA,Dow breaks 20 000 points  S P on track for 3rd record closing high,155.16668701171875
2017-01-25,BA,Dow hits 20 000 as Trump and earnings reignite rally,155.16668701171875
2017-01-25,BA,Boeing core Q4 EPS up 54  at  2 47 as revenues mostly flat ,155.16668701171875
2017-01-25,BA,Boeing shares jump on strong fourth quarter results  2017 forecast,155.16668701171875
2017-01-25,BA,Wall St  points to higher open with Dow 20K back in play,155.16668701171875
2017-01-25,BA,Chile battles devastating wildfires as international help pours in,155.16668701171875
2017-01-25,BA,Dow tops 20 000 on revitalized Trump trade  earnings,155.16668701171875
2017-01-25,BA,Top 5 Things to Know In the Market on Wednesday,155.16668701171875
2017-01-25,BA,Boeing Co  Stock Shares Fly As Q4 Earnings Top Estimates,155.16668701171875
2017-01-25,BA,Ryanair in cooperation talks with AlItalia  to fight Lufthansa deal,155.16668701171875
2017-01-27,BA,Boeing machinists in South Carolina to vote in February on unionizing,155.4818878173828
2017-01-27,BA,Trump says he wants to cut Navy submarines  price  Fox News interview,155.4818878173828
2017-01-27,BA,Boeing wins  2 1 billion Pentagon contract for 15 KC 46 refueling aircraft,155.4818878173828
2017-01-27,BA,Pentagon starts cost cutting reviews of F 35  presidential aircraft,155.4818878173828
2017-01-30,BA,China Sets The Stage To Replace U S  As Global Trade Leader,153.50711059570312
2017-01-30,BA,Visa row overshadows Iranian investment drive and plane deals,153.50711059570312
2017-01-31,BA,As Trump thunders  investors watch for rain,151.5137481689453
2017-01-31,BA,3 Ways To Invest Under A Trump Presidency,151.5137481689453
2017-02-01,BA,Exclusive  Japan secures extra cost cuts on U S  F 35 fighter jet package   sources,152.023681640625
2017-02-01,BA,Amazon plans more than 200 daily flights from new cargo hub,152.023681640625
2017-02-01,BA,Amazon to spend  1 49 billion on air cargo hub  fans talk of bigger ambitions,152.023681640625
2017-02-01,BA,Iran s president calls Trump a political novice over travel ban,152.023681640625
2017-02-02,BA,U S  stocks lower at close of trade  Dow Jones Industrial Average down 0 06 ,150.43820190429688
2017-02-03,BA,Lockheed says didn t seek help from Trump s ex campaign manager,150.56808471679688
2017-02-03,BA,NASA unveils spaceship hatch 50 years after fatal Apollo 1 fire,150.56808471679688
2017-02-03,BA,iFOREX Daily Analysis   February 03 2017,150.56808471679688
2017-02-06,BA,U S  stocks lower at close of trade  Dow Jones Industrial Average down 0 09 ,152.03294372558594
2017-02-06,BA,Right Now Politics  Not Economics  Is Driving Markets,152.03294372558594
2017-02-06,BA,China s C919 jet expects first flight within first half of 2017  state media,152.03294372558594
2017-02-07,BA,iFOREX Daily Analysis   February 07 2017,154.36935424804688
2017-02-07,BA,Exclusive  Boeing s space taxis to use more than 600 3D printed parts,154.36935424804688
2017-02-08,BA,Trump  aviation executives to discuss infrastructure Thursday  sources,153.1817169189453
2017-02-08,BA,Canada gives aid to Bombardier  vows to defend any trade dispute,153.1817169189453
2017-02-08,BA,Boeing front runner for  13 8 billion Singapore Airlines order   Bloomberg,153.1817169189453
2017-02-09,BA,Exclusive  Lockheed says U S  may take  fresh look  at its India F 16 plan,153.6212615966797
2017-02-09,BA,Boeing s  14 billion Singapore Air order does not fill 777  787 gap  CEO,153.6212615966797
2017-02-09,BA,Boeing wins  13 8 billion Singapore Airlines order for wide body jets,153.6212615966797
2017-02-10,BA,Amazon warns that trade protectionism could hurt business,155.44471740722656
2017-02-13,BA,Boeing  machinists face off over union at South Carolina plant,157.12796020507812
2017-02-13,BA,India navy spurns homemade warplane  latest blow to Asia push for self reliance,157.12796020507812
2017-02-14,BA,Boeing expects 737 MAX 9 to fly in April as larger version takes shape,157.56744384765625
2017-02-15,BA,Gulf States to maintain defense spending despite oil price slump,158.31553649902344
2017-02-15,BA,Maiden flight of China built amphibious aircraft expected in first half of 2017,158.31553649902344
2017-02-15,BA,Workers at Boeing s South Carolina plant reject union,158.31553649902344
2017-02-15,BA,Global aerospace boom is over  but likely no bust ahead  analyst,158.31553649902344
2017-02-15,BA,Lies  Damn Lies  And Taxes,158.31553649902344
2017-02-16,BA,China s Juneyao Airlines finalizes  1 32 billion order for five Boeing 787s,159.72756958007812
2017-02-16,BA, It would be huge   U S  border town confronts possible import tax,159.72756958007812
2017-02-16,BA,Why Trumponomics Fails,159.72756958007812
2017-02-17,BA,Trump pledges to protect U S  jobs during visit to Boeing plant,161.50430297851562
2017-02-17,BA,Trump goes to his comfort zone  campaigner in chief,161.50430297851562
2017-02-21,BA,Investors bet on Israel tech stock windfall under Trump,164.16940307617188
2017-02-21,BA,Airbus faces multiple challenges as it enters new era,164.16940307617188
2017-02-21,BA,SpaceX launches rocket from historic NASA pad in Florida,164.16940307617188
2017-02-22,BA,Russian space craft lifts off for international space station,163.9823760986328
2017-02-22,BA,iFOREX Daily Analysis   February 22  2017,163.9823760986328
2017-02-23,BA,Norwegian Air to offer U S  Europe fares starting at  65 one way,165.38504028320312
2017-02-23,BA,Boeing  not competitive   but tax reform would help  CFO,165.38504028320312
2017-02-24,BA,Exclusive  Trump says Republican border tax could boost U S  jobs,165.92742919921875
2017-02-24,BA,Boeing to open first European factory  to invest 20 million pounds,165.92742919921875
2017-02-27,BA,U S  core capital goods orders fall  manufacturing recovery intact,167.78826904296875
2017-02-27,BA,Dow hits 12th record high close  Trump talks up infrastructure spending,167.78826904296875
2017-02-28,BA,With businesses split on U S  border tax  wider reform looks shaky,168.536376953125
2017-02-28,BA,Business Watch  Starbucks  Italian job,168.536376953125
2017-02-28,BA,Dollar Weaker As Market Worries Over Trump Speech,168.536376953125
2017-02-28,BA,Boeing Wins  679M Navy Deal To Procure 12 Combat Aircraft,168.536376953125
2017-02-28,BA,US Stocks To Surge On Upcoming Jobs Data,168.536376953125
2017-02-28,BA,NASA inks deal with Boeing for extra rides for astronauts,168.536376953125
2017-02-28,BA,5 Stocks To Buy As Trump Promises To Spend Big On Defense,168.536376953125
2017-03-01,BA,The Diversification Benefits Of Gold,171.97763061523438
2017-03-01,BA,Dow 21k And A March Rate Hike,171.97763061523438
2017-03-02,BA,Boeing sues Denmark over lack of access to documents in combat jet dispute,171.11732482910156
2017-03-02,BA,South Africa in talks with Airbus  Boeing to print 3D parts,171.11732482910156
2017-03-02,BA,Exclusive  Spirit Aero tells suppliers jobs may go offshore   sources,171.11732482910156
2017-03-02,BA,Boeing gets 1 880 union workers to take voluntary layoffs,171.11732482910156
2017-03-03,BA,Boeing sounds out Indian carriers on 737 MAX 10 aircraft,170.35986328125
2017-03-03,BA,Lockheed says in talks with Spain  Belgium  others on buying F 35s,170.35986328125
2017-03-03,BA,Saudi king s Bali beach holiday turns into military exercise,170.35986328125
2017-03-06,BA,Airbus sees about 30 percent fewer orders for jet industry in 2017,169.19093322753906
2017-03-07,BA,Elon Musk At It Again As SpaceX Plans To Send Civilians To The Moon,170.21026611328125
2017-03-07,BA,Bezos  rocket company Blue Origin signs Eutelsat as first customer,170.21026611328125
2017-03-07,BA,United looking at second hand aircraft  rules out A380,170.21026611328125
2017-03-08,BA,Boeing says 737 MAX 10X jet has support from airlines  suppliers,169.9484100341797
2017-03-08,BA,Exclusive  Airbus may ditch A380 s grand staircase as sales tumble,169.9484100341797
2017-03-08,BA,Aircraft lessors lukewarm on Boeing s planned 737 10 jet,169.9484100341797
2017-03-10,BA,U S  stocks higher at close of trade  Dow Jones Industrial Average up 0 21 ,167.1056365966797
2017-03-13,BA,CDB Aviation seeks growth as it confirms Boeing order,167.43296813964844
2017-03-14,BA,SpaceX defeats Boeing Lockheed partnership for GPS launch contract,167.1337127685547
2017-03-16,BA,Trump eyes  flexible  Islamic State war fund  Guantanamo upgrade,166.62876892089844
2017-03-16,BA,Boeing  U S  government sign  3 4 billion deal for AH 64E Apache helicopters,166.62876892089844
