date,ticker,news,close_price
2019-05-24,BA,Gol Linhas  GOL  To Start Flights To Aracatuba In November,348.578857421875
2019-05-24,BA,Stock Market News For May 28  2019,348.578857421875
2019-05-24,BA,How Durable Is This Dollar Top  ,348.578857421875
2019-05-24,BA,Stocks    Foot Locker Slumps Premarket  Amazon  Boeing Rise,348.578857421875
2019-05-24,BA,China airline association estimates losses from 737 MAX grounding at  579 million,348.578857421875
2019-05-24,BA,What Kind Of Currency Bounce Is This  ,348.578857421875
2019-05-24,BA,Defying Congress  Trump sets  8 billion plus in weapons sales to Saudi Arabia  UAE,348.578857421875
2019-05-24,BA,Durable Goods Orders Growth To Slow In April,348.578857421875
2019-05-24,BA,Boeing at two week high as approval for 737 MAX to fly seen by late June,348.578857421875
2019-05-24,BA,Boeing faces SEC probe into disclosures about 737 MAX problems  Bloomberg,348.578857421875
2019-05-24,BA,Weak U S  manufacturing underscores slowing economic growth,348.578857421875
2019-05-24,BA,British Airways to resume Pakistan flights next week after a decade,348.578857421875
2019-05-24,BA,The U S  China Trade War Could Lower The Interest Rate Outlook ,348.578857421875
2019-05-28,BA,Boeing Secures Order For 8 Dreamliners From Air New Zealand ,348.5592346191406
2019-05-28,BA,HEICO Corp   HEI  Q2 Earnings Top Estimates  Guidance Raised,348.5592346191406
2019-05-28,BA,Trump seeks extra  1 6 billion in NASA spending to return to moon by 2024,348.5592346191406
2019-05-28,BA,Airline Stock Roundup  UAL Gives Update On MAX 737 Grounding  GOL In Focus,348.5592346191406
2019-05-29,BA,Airbus urges airlines to pressure Boeing over subsidy row,342.58746337890625
2019-05-29,BA,Ten years on  questions remain over response to Air France 447,342.58746337890625
2019-05-29,BA,Budget airlines the flavor of South Korean aviation market  Jeju travel booms,342.58746337890625
2019-05-29,BA,A Brazil Firm Sweats Over Getting Caught in U S  China Trade War,342.58746337890625
2019-05-29,BA,Boeing s 737 MAX Woes Aren t Over Yet  Wait Before Buying Stock,342.58746337890625
2019-05-29,BA,Stocks    Dick s Sporting Goods Rises Premarket  Canada Goose  Boeing Slump,342.58746337890625
2019-05-29,BA,Airbus cheers 50th anniversary with flypast but little swagger,342.58746337890625
2019-05-29,BA,Top 5 Things to Know in the Market on Wednesday,342.58746337890625
2019-05-29,BA,Boeing surprised Canada changed rules of jet competition to allow Lockheed Martin bid,342.58746337890625
2019-05-29,BA,Boeing 737 MAX may not return to service until August  IATA head,342.58746337890625
2019-05-29,BA,Boeing aims for first flight of 777X in late June  sources,342.58746337890625
2019-05-30,BA,Collapsed Jet Airways  ex partners  rivals scramble to fill India capacity void,343.638427734375
2019-05-30,BA,U S  regulators say some Boeing 737 MAX planes may have faulty parts,343.638427734375
2019-05-30,BA,Airbus close to deal to sell A330neo to Virgin Atlantic  sources,343.638427734375
2019-05-30,BA,Trade gloom  rising oil  Boeing 737 MAX woes to cloud aviation summit,343.638427734375
2019-05-30,BA,Why Is Spirit Aerosystems  SPR  Down 6 5  Since Last Earnings Report ,343.638427734375
2019-05-30,BA,Airlines want joint lifting of 737 MAX ban  but EU cautious,343.638427734375
2019-05-31,BA,AirAsia in talks to buy proposed new Airbus A321XLR  sources,335.5255432128906
2019-05-31,BA,China threatens corporate hit list on eve of new tariffs on U S  imports,335.5255432128906
2019-06-03,BA,U S  to sell 34 surveillance drones to allies in South China Sea region,332.8540344238281
2019-06-03,BA,Azerbaijan cancels  1 billion contract with Boeing for safety reasons,332.8540344238281
2019-06-03,BA,Malaysia Airlines says 737 MAX jet deliveries may be delayed  eyes turnaround,332.8540344238281
2019-06-03,BA,Stocks   U S  Futures Slip Amid Global Trade Tensions,332.8540344238281
2019-06-03,BA,Wall Street tumbles as Facebook  Alphabet extend slide,332.8540344238281
2019-06-03,BA,Factbox  Trump administration departures  firings  reassignments,332.8540344238281
2019-06-04,BA,More Problems For Boeing s 737  When It Will Fly Again ,338.4819641113281
2019-06-04,BA,American Airlines top executives buy company shares worth  2 4 million,338.4819641113281
2019-06-04,BA,U S  lawmakers to push back against Trump on Saudi weapons sales,338.4819641113281
2019-06-04,BA,Global Capital Markets Stabilizing  RBA Cut Rate To Record Low 1 25 ,338.4819641113281
2019-06-04,BA,Polish LOT rules out cancelling Boeing 737 MAX order,338.4819641113281
2019-06-04,BA,Boeing Wins  35M Deal To Support Small Diameter Bomb Program,338.4819641113281
2019-06-05,BA,NASA s first SpaceX astronauts ready for  messy camping trip  to space,342.53839111328125
2019-06-05,BA,Boeing s 777X faces engine snags  questions rise over delivery goal,342.53839111328125
2019-06-05,BA,United Technologies nears deal to merge aerospace unit with Raytheon  source,342.53839111328125
2019-06-06,BA,American Airlines extends Boeing 737 MAX cancellations through September 3,344.394775390625
2019-06-06,BA,United Technologies  Raytheon to create  120 billion aerospace and defense giant,344.394775390625
2019-06-06,BA,American Airlines Extends 737 MAX Grounding Period Once More,344.394775390625
2019-06-06,BA,Raytheon  United Tech To Merge  Aerospace ETFs In Focus,344.394775390625
2019-06-06,BA,As Trade Troubles Brew  Defense Stocks Guard Industrial Fort,344.394775390625
2019-06-06,BA,U S  trade deficit shrinks on weak imports  exports,344.394775390625
2019-06-06,BA,Exclusive  U S  pursues sale of over  2 billion in weapons to Taiwan  sources say  angering China,344.394775390625
2019-06-06,BA,Bear Of The Day  Boeing  BA ,344.394775390625
2019-06-07,BA,Boeing delayed fix of defective 737 MAX warning light for three years  U S  lawmakers,347.4002380371094
2019-06-07,BA,Spirit cuts workweek in wake of 737 MAX groundings  union,347.4002380371094
2019-06-07,BA,Got  50 million for a vacation  NASA to open space station to private citizens,347.4002380371094
2019-06-07,BA,China Weekly Letter   Are We Heading For An All Out Trade War ,347.4002380371094
2019-06-07,BA,Qatar Airways to seek compensation from Boeing over MAX grounding,347.4002380371094
2019-06-07,BA,Stocks     Beyond Meat  Zoom  Barnes   Noble Rise Premarket  DocuSign Falls,347.4002380371094
2019-06-10,BA,Trump says United Tech  Raytheon deal may hurt competition,347.4984436035156
2019-06-10,BA,United Technologies  Raytheon slip after Trump comments on mega deal,347.4984436035156
2019-06-10,BA,Top Analyst Reports For Oracle  Eli Lilly   Mondelez ,347.4984436035156
2019-06-10,BA,Mergers   Deals To Boost Defense Sector  3 Fund Winners,347.4984436035156
2019-06-10,BA,United Technologies   Raytheon  Becoming The  2 Player In Aerospace   Defense,347.4984436035156
2019-06-10,BA,Top 5 Things to Know in the Market on Monday,347.4984436035156
2019-06-11,BA,Airline Stock Roundup  AAL s 737 MAX Grounding Update  HA s Traffic Report   More ,343.1080627441406
2019-06-11,BA,Stocks Rally On Positive Trade Developments,343.1080627441406
2019-06-11,BA,Planemakers race for wide body orders in Asia showdown,343.1080627441406
2019-06-11,BA,Boeing May deliveries fall 56  as 737 MAX grounding continues to weigh,343.1080627441406
2019-06-11,BA,Investor Ackman opposes United Technologies  aerospace merger with Raytheon  source,343.1080627441406
2019-06-11,BA,Boeing Short,343.1080627441406
2019-06-11,BA,The Call Of The Void,343.1080627441406
2019-06-11,BA,New Zealand selects Lockheed C 130J as preferred military transport replacement,343.1080627441406
2019-06-11,BA,Boeing  BA  Secures Navy Deal To Modify P 8A Jet Program,343.1080627441406
2019-06-11,BA,Aerospace   Defense Sector Faces Consolidation Pressure,343.1080627441406
2019-06-12,BA,Tires blow on United jet during Newark airport landing  no injuries,340.8490295410156
2019-06-12,BA,Boeing  BA  Wins  194M Deal For MH 47G Rotary Wing Aircraft ,340.8490295410156
2019-06-12,BA,American Airlines CEO says  highly likely  Boeing 737 MAX will fly by mid August,340.8490295410156
2019-06-12,BA,FAA says has no timetable for Boeing 737 MAX s return to service,340.8490295410156
2019-06-12,BA,Mexico says presidential plane sale to help fund migration plan,340.8490295410156
2019-06-12,BA,NATO faces big bill if it does not pick AWACS successor soon  officials,340.8490295410156
2019-06-12,BA,Republicans in Congress push back on Trump weapons packages to Saudi Arabia  UAE,340.8490295410156
2019-06-12,BA,Saudia airline close to placing order for Airbus aircraft  sources,340.8490295410156
2019-06-12,BA,CFM erases jet engine output delay  cautious on rate increases,340.8490295410156
2019-06-13,BA,Boeing says will take time to win back confidence,342.64642333984375
2019-06-13,BA,Boeing crisis  trade tensions cast pall over air show,342.64642333984375
2019-06-13,BA,3 Stocks To Watch In The Coming Week  Canopy Growth  GE  Adobe,342.64642333984375
2019-06-13,BA,USD Resilience In The Face Of Aggressive Fed Easing Expectations,342.64642333984375
2019-06-13,BA,Exclusive  Boeing seeking to reduce scope  duration of some physical tests for new aircraft   sources,342.64642333984375
2019-06-13,BA,Boeing Wins  41M Navy Deal For F A 18E F Aircraft Support,342.64642333984375
2019-06-13,BA,Airbus in talks with Indigo Partners on A321XLR sale  sources,342.64642333984375
2019-06-13,BA,Airbus delivers first A350 to Japan after landmark deal,342.64642333984375
2019-06-13,BA,Southwest extends Boeing 737 MAX cancellations through Sept  2,342.64642333984375
2019-06-14,BA,Norwegian Air expects Boeing 737 MAX fleet to remain grounded until end of August,340.9767150878906
2019-06-14,BA,Exclusive  Business and pleasure   how Russian oil giant Rosneft uses its corporate jets,340.9767150878906
2019-06-14,BA,Airbus agrees new contract for delayed A400M military transporter,340.9767150878906
2019-06-14,BA,May Air Fares Rise Despite Weak Oil Prices  What Lies Ahead ,340.9767150878906
2019-06-14,BA,Airbus readies A321XLR jetliner launch  sees A330neo sales,340.9767150878906
2019-06-14,BA,Alaska Air Group  ALK  May Load Factor Up  Q2 View Upbeat,340.9767150878906
2019-06-14,BA,Boeing wins  6 5 billion U S  defense contract  Pentagon,340.9767150878906
2019-06-14,BA,Oman Air plans Airbus talks unless Boeing provides 737 Max support plan,340.9767150878906
2019-06-17,BA,Airbus faces cabin comfort dilemma as it launches A321XLR jet,348.578857421875
2019-06-17,BA,Stocks   Stocks Flat as Financials Fall on Growing Rate Cut Hopes,348.578857421875
2019-06-17,BA,New blow to Boeing from engine delay  Airbus long range rival takes off,348.578857421875
2019-06-17,BA,GE says forced to redesign part for GE9X jet engine,348.578857421875
2019-06-17,BA,FAA moves to support growth of civil supersonic air industry,348.578857421875
2019-06-17,BA,Airline Stock Roundup  LUV s 737 MAX Update  ALK   JBLU s Bullish Q2 Views ,348.578857421875
2019-06-17,BA,Boeing lifts 20 year industry demand forecast to  6 8 trillion,348.578857421875
2019-06-17,BA,Top 5 Things to Know in the Market on Monday,348.578857421875
2019-06-17,BA,Boeing Hikes 20 Year Jetliner Demand Forecast By 6 7  To  16T,348.578857421875
2019-06-17,BA,Boeing says sorry for MAX 737 crashes  promises to learn lessons,348.578857421875
2019-06-18,BA,Stocks   Boeing  Facebook  Beyond Meat Rise Premarket  Oracle Falls,367.2993469238281
2019-06-18,BA,Qantas adds 10 Airbus jets to order  will take 36 A321XLRs,367.2993469238281
2019-06-18,BA,They Meet  We Rally,367.2993469238281
2019-06-18,BA,NASA boss says  no doubt  SpaceX explosion delays flight program,367.2993469238281
2019-06-18,BA,Exclusive  U S  seen open to mechanism to end aircraft subsidy spat   sources,367.2993469238281
2019-06-18,BA,South Korea s Korean Air to buy 30 Boeing 787 planes for  9 67 billion,367.2993469238281
2019-06-18,BA,Company News For Jun 19  2019,367.2993469238281
2019-06-18,BA,Airbus seeks new partners to expand in U S  space market,367.2993469238281
2019-06-18,BA,Boeing Rises 5 ,367.2993469238281
2019-06-18,BA,Boost for Boeing as BA owner backs grounded jet with 200 plane order,367.2993469238281
2019-06-18,BA,Eviation targets commuters with electric plane Alice,367.2993469238281
2019-06-18,BA,Shanahan pulls out of Pentagon job as reports emerge of family violence,367.2993469238281
2019-06-18,BA,With Esper  Pentagon inherits an army veteran long focused on China,367.2993469238281
2019-06-19,BA, Sully  Sullenberger blasts U S  aircraft certification process  says 737 MAX pilots need new simulator training,361.99554443359375
2019-06-19,BA,Trump s big show on July 4  patriotic speech or campaign rally ,361.99554443359375
2019-06-19,BA,GE Aviation  A Shining Star In Slowing Aerospace Sector ,361.99554443359375
2019-06-19,BA,Airbus seals deals with big buyers  following Boeing s MAX sale,361.99554443359375
2019-06-19,BA,Boeing Foresees  2 5T Defense Market Opportunities Til 2028,361.99554443359375
2019-06-19,BA,American Airlines  AAL  Inks Deal To Buy 50 Jets From Airbus,361.99554443359375
2019-06-19,BA,Southwest Falls Midday  Pilots Seek Compensation for Grounded Boeings,361.99554443359375
2019-06-19,BA,Stocks   U S  Futures Flat Ahead of Fed Rate Decision,361.99554443359375
2019-06-19,BA,StockBeat  IAG s Rescue Act for the 737 MAX Goes Down Badly,361.99554443359375
2019-06-19,BA,Eurofighter  NATO launch studies on long term evolution of fighter,361.99554443359375
2019-06-19,BA,Boeing Is Showing Signs Of An Unexpected Recovery ,361.99554443359375
2019-06-20,BA,U S  arms makers see booming European demand as threats multiply,368.2029724121094
2019-06-20,BA,Costs  delays mount for Boeing s NASA launch system  audit finds,368.2029724121094
2019-06-20,BA,Southwest Q2 RASM View Up  Cost View Bleak On MAX Groundings,368.2029724121094
2019-06-20,BA,Senate rejects Saudi arms sales in rebuke to Trump,368.2029724121094
2019-06-20,BA,3 Aerospace Growth Stocks To Consider,368.2029724121094
2019-06-20,BA,American Outdoor Brands   AOBC  Q4 Earnings   Sales Beat,368.2029724121094
2019-06-20,BA,Company News For Jun 21  2019,368.2029724121094
2019-06-20,BA,Airbus demands chance to bid for IAG s surprise Boeing 737 MAX order,368.2029724121094
2019-06-20,BA,Boeing Crisis Continues As Airbus Steals Thunder In Air Show,368.2029724121094
2019-06-20,BA,Airbus  did not get chance to bid for the MAX order IAG gave to Boeing,368.2029724121094
2019-06-20,BA,Airbus Launches A321XLR In Paris Air Show  Orders Roll In,368.2029724121094
2019-06-21,BA,Witching Day Dawns With Stocks Perched At Highs And Geopolitical Tension Pulsing,365.2171325683594
2019-06-21,BA,Pompeo likely to calm tension with India before expected Trump Modi talks,365.2171325683594
2019-06-24,BA,India  U S  nearing industrial security pact for defense tech transfers,367.3288269042969
2019-06-24,BA,Airline Stock Roundup  LUV s Bullish Q2 RASM View  AAL  JBLU   DAL In Focus,367.3288269042969
2019-06-24,BA,Headwinds Hound American Airlines  Better To Ditch The Stock ,367.3288269042969
2019-06-24,BA,S P 500 slips as healthcare drags  investors eye G20 summit,367.3288269042969
2019-06-25,BA,Durable Goods  Advance Trade Worse Than Expected,362.7420349121094
2019-06-25,BA,Boeing  Until The 737 Max Flies  This Dow Stock Is In A Holding Pattern,362.7420349121094
2019-06-25,BA,USDJPY Almost Flat On Hopes And Hypes Of U S  China Trade Truce And Trump s Iran,362.7420349121094
2019-06-26,BA,Emergency landing by United flight briefly closes Newark Airport,368.2619323730469
2019-06-26,BA,U S  prosecutors subpoena records on Boeing 787 production  Seattle Times,368.2619323730469
2019-06-26,BA,U S  core capital goods orders rebound  shipments increase,368.2619323730469
2019-06-26,BA,FAA Finds New Flaw In 737 Max  Will Airline Stocks Suffer ,368.2619323730469
2019-06-26,BA,Q1 GDP Stays 3 1   Jobless Claims Climb To 227K,368.2619323730469
2019-06-26,BA,Q1 GDP Remains Unchanged,368.2619323730469
2019-06-26,BA,U S  regulator cites new flaw on grounded Boeing 737 MAX,368.2619323730469
2019-06-26,BA,United Airlines extends 737 MAX cancellations until Sept  3,368.2619323730469
2019-06-26,BA,Airlines and regulators meet to discuss Boeing 737 MAX un grounding efforts,368.2619323730469
2019-06-26,BA,Boeing looms large over struggling U S  manufacturing sector,368.2619323730469
2019-06-27,BA,S P 500 rises on investor optimism ahead of G20 summit,357.5364074707031
2019-06-27,BA,Boeing sees fix for latest 737 MAX software flaw in September,357.5364074707031
2019-06-27,BA,Opening Bell  Investors Want More Evidence Of Imminent Trump Xi Trade Truce,357.5364074707031
2019-06-27,BA,United Airlines To Add Flight On San Francisco Hong Kong Route,357.5364074707031
2019-06-27,BA,Stock Market News For Jun 28  2019,357.5364074707031
2019-06-27,BA,Top 5 Things to Know in the Market on Thursday,357.5364074707031
2019-06-27,BA,Stocks   Wall Street Rises Modestly as Investors Play G20 Waiting Game,357.5364074707031
2019-06-27,BA,Stocks   Boeing  ConAgra Fall Premarket  Ford  Walgreens Rise ,357.5364074707031
2019-06-27,BA,S P Snaps 4 Day Skid As G20 Nears ,357.5364074707031
2019-06-27,BA,Boeing thinks it will complete it software update for 737 MAX by September  official,357.5364074707031
2019-06-27,BA,Boeing shares slip as grounded 737 MAX faces new hurdle,357.5364074707031
2019-06-27,BA,U S  China trade truce hopes rekindle risk appetite,357.5364074707031
2019-06-27,BA,Airlines urge regulators to work together to return 737 MAX to service,357.5364074707031
2019-06-28,BA,Lockheed Martin Wins  106M Deal To Support Apache Helicopter,357.526611328125
2019-06-28,BA,Defense contractor consolidation a security concern  U S  Air Force acquisition head,357.526611328125
2019-06-28,BA,U S  lags in export financing arms race fueled by China  EXIM report,357.526611328125
2019-06-28,BA,Third Point tells United Technologies that it opposes Raytheon merger,357.526611328125
2019-06-28,BA,Boeing s 737 Max Software Outsourced to  9 an Hour Engineers,357.526611328125
2019-06-28,BA,From wind tunnels to megadeals  the Boeing sales boss facing new MAX storm,357.526611328125
2019-07-01,BA,Ethiopian crash families criticize Boeing over donation plan,350.1110534667969
2019-07-01,BA,U S  factory activity falls to more than two and a half year low,350.1110534667969
2019-07-01,BA,Hedge fund chief Daniel Loeb opposes United Technologies  Raytheon merger,350.1110534667969
2019-07-01,BA,Company News For Jul 2  2019,350.1110534667969
2019-07-01,BA,USTR proposes  4 billion in potential additional tariffs over EU aircraft subsidies,350.1110534667969
2019-07-01,BA,U S  Proposes More Tariffs on EU Goods in Airbus Boeing Spat,350.1110534667969
2019-07-01,BA,Southwest expects Boeing 737 MAX cancellations beyond Oct  1  CEO,350.1110534667969
2019-07-02,BA,U N  aviation agency to review global pilot training in shadow of 737 MAX crashes,347.8520202636719
2019-07-02,BA,EU open to talks with U S  in aircraft subsidies dispute,347.8520202636719
2019-07-02,BA,NASA tests abort system on astronaut capsule built for moon missions,347.8520202636719
2019-07-02,BA,ECB Policy Makers See No Rush for July Interest Rate Cut,347.8520202636719
2019-07-02,BA,Global Equities Mixed After Yesterday s Surge,347.8520202636719
2019-07-02,BA,Top 5 Things to Know in the Market on Tuesday,347.8520202636719
2019-07-02,BA,Trump plans tanks and flyovers at Fourth of July celebration in Washington,347.8520202636719
2019-07-02,BA,Trump says there will be tanks at July 4 celebration in Washington,347.8520202636719
2019-07-02,BA,GBP Traders Hedge Against Further Drop,347.8520202636719
2019-07-03,BA,Boeing Wins  43M Deal To Provide Edge Flaps For F A 18 Jets,348.1565246582031
2019-07-03,BA,U S  trade deficit at five month high  labor market slowing,348.1565246582031
2019-07-03,BA,Yields Extend Decline  Equity Markets Are Mixed,348.1565246582031
2019-07-03,BA,White House says Trump s July Fourth will be patriotic  not political,348.1565246582031
2019-07-03,BA,Boeing promises  100 million to help families affected by deadly crashes,348.1565246582031
2019-07-03,BA,U S  factory orders fall for second straight month,348.1565246582031
2019-07-03,BA,Tanks in Washington ahead of Trump s Fourth of July pageant,348.1565246582031
2019-07-05,BA,Airbus delivered close to 390 jets in H1  sources,349.521728515625
2019-07-05,BA,U S  job growth seen accelerating  rate cut still expected,349.521728515625
2019-07-05,BA,SpiceJet plane blocking Mumbai runway moved  airport,349.521728515625
2019-07-05,BA,3 Stocks To Watch In The Coming Week  PepsiCo  Boeing  Bed  Bath   Beyond,349.521728515625
2019-07-05,BA,Airlines  Q2 Earnings Picture Bright  3 Stocks In Focus,349.521728515625
2019-07-05,BA,Saudi airline flyadeal picks Airbus jets over grounded Boeing MAX,349.521728515625
2019-07-05,BA,Saudi Airline Picks A320 Over 737 MAX  Is Boeing In Trouble ,349.521728515625
2019-07-08,BA,Russia s Ural Airlines plans to get first Boeing 737 MAX in December  Interfax,344.8661804199219
2019-07-08,BA,Exclusive  Airbus  Boeing indicate they may pull out of Canada fighter jet race   sources,344.8661804199219
2019-07-08,BA,Amazon s fleet expansion a boost for Israel Aerospace,344.8661804199219
2019-07-08,BA,Top 5 Things to Know in the Market on Monday,344.8661804199219
2019-07-08,BA,German diplomat tells U S   EU  don t use agriculture to block trade deal,344.8661804199219
2019-07-09,BA,Airbus confirms deliveries rose 28  in first half of 2019,346.8011169433594
2019-07-09,BA,Boeing deliveries fall 37   set to lose biggest planemaker title,346.8011169433594
2019-07-09,BA,Richard Branson s Virgin Galactic plans to go public by end 2019,346.8011169433594
2019-07-09,BA,US Ok s  2 2B Arms Sales To Taiwan  3 Defense Stocks In Focus,346.8011169433594
2019-07-10,BA,Will Boeing  BA  Lose The Largest Jet Maker Title To Airbus ,346.025146484375
2019-07-10,BA,American Airlines raises forecast for key revenue measure,346.025146484375
2019-07-10,BA,German minister to meet with Lighthizer on aircraft subsidies issue Thursday,346.025146484375
2019-07-10,BA,U S  May wholesale inventories unrevised  sales edge up,346.025146484375
2019-07-10,BA,Branson s Virgin Orbit to test key rocket Wednesday   source,346.025146484375
2019-07-10,BA,Ryanair says Boeing eyes MAX flights by October  cites 2020 growth risk,346.025146484375
2019-07-10,BA,European Stocks Trade Lower As Investors Await Powell Testimony,346.025146484375
2019-07-11,BA,German economic minister remains hopeful on tariffs  aircraft subsidy dispute,352.6058349609375
2019-07-11,BA,Families and Ethiopian farmers feel in the dark over Boeing s aid offer,352.6058349609375
2019-07-11,BA,Boeing reshuffles management of grounded 737  memo,352.6058349609375
2019-07-11,BA,Attorney General Barr recuses himself from Boeing 737 MAX probe  Justice Dept ,352.6058349609375
2019-07-11,BA,Ryanair sees risk to 2020 growth if 737 MAX grounded beyond November,352.6058349609375
2019-07-11,BA,Norwegian Air CEO and co founder Kjos quits top job,352.6058349609375
2019-07-11,BA,Air China plans to buy 20 A350 900 aircraft from Airbus,352.6058349609375
2019-07-11,BA,French digital tax compliant with international accords  source,352.6058349609375
2019-07-11,BA,American Airlines extends Boeing 737 MAX cancellations for fourth time,352.6058349609375
2019-07-11,BA,Will Weak Bell Unit Sales Hit Textron s  TXT  Q2 Earnings ,352.6058349609375
2019-07-12,BA,Airbus pulls anniversary book over fraud probe concerns  sources,358.8230895996094
2019-07-12,BA,Thomas Cook turns to China s Fosun to save oldest travel firm,358.8230895996094
2019-07-12,BA,Boeing 737 MAX to remain off United Airlines schedule until November 3,358.8230895996094
2019-07-12,BA,Stocks   Deutsche Bank  Boeing  Snap Rise Premarket  Illumina Falls,358.8230895996094
2019-07-12,BA,Top 5 Things to Know in the Market on Friday,358.8230895996094
2019-07-15,BA,United Airlines  UAL  Q2 2019 Earnings Preview,355.1693115234375
2019-07-15,BA,Stocks   Citigroup  Amazon com  Rise Premarket  Boeing  CIRCOR Fall,355.1693115234375
2019-07-16,BA,Factbox  Airlines count the cost of Boeing 737 MAX grounding,356.2890319824219
2019-07-16,BA,United Airlines quarterly profit beats on strong travel demand  higher fares,356.2890319824219
2019-07-16,BA,SpaceX astronaut mission looking  increasingly difficult  in 2019  executive,356.2890319824219
2019-07-16,BA,Airline Stock Roundup  DAL   UAL s Earnings Beat  AAL s Bullish Q2 View   More,356.2890319824219
2019-07-16,BA,Ryanair CEO says confident in  great  Boeing 737 MAX despite delays,356.2890319824219
2019-07-16,BA,Ryanair cuts summer 2020 growth rate on Boeing MAX doubts,356.2890319824219
2019-07-16,BA,Boeing  BA  Expected To Beat Earnings Estimates  What To Know Ahead Of Q2 Release,356.2890319824219
2019-07-16,BA,Stocks   Wall Street Flat After Mixed Bank Earnings ,356.2890319824219
2019-07-16,BA,Father whose family died in Ethiopian plane crash to brief Congress,356.2890319824219
2019-07-17,BA,Boeing to spend half of  100 million fund to support 737 MAX crash victim families,362.9384460449219
2019-07-17,BA,United says may not receive full delivery of 737 MAX by next year,362.9384460449219
2019-07-17,BA,United Airlines  UAL  Beats On Q2 Earnings  Tweaks  19 View,362.9384460449219
2019-07-17,BA,Explainer  NASA aims to build on moon as a way station for Mars,362.9384460449219
2019-07-17,BA,Ryanair Irish pilot union to decide on strike ballot next week,362.9384460449219
2019-07-18,BA,Will Aerospace Unit Drive General Dynamics   GD  Q2 Earnings ,354.67822265625
2019-07-18,BA,Will F 35 Program Boost Lockheed Martin s  LMT  Q2 Earnings ,354.67822265625
2019-07-18,BA,Will After Tax Charge Of  4 9B Hurt Boeing s  BA  Q2 Earnings ,354.67822265625
2019-07-18,BA,Will Mission Systems Unit Drive Northrop s  NOC  Q2 Earnings ,354.67822265625
2019-07-18,BA,Will 737 Max Issue Hamper Boeing s  BA  Earnings In Q2 ,354.67822265625
